<?xml version="1.0"  encoding="ISO-8859-1" ?>
<!DOCTYPE cfg SYSTEM "FileTranslatorCfg.dtd" >

<!-- 
 $Revision$ $Date$ $Author$
-->

<cfg>
 <inputs qualifier_row_present='1' > 
  <header>
    <col name='R.foreground' header_val='Dens - Levels' qualifier='0' req='1' />
    <col name='R.sd' header_val='SD - Levels' qualifier='0' req='0' />
    <col name='R.x' header_val='PosX - mm' qualifier='0' req='0' />
    <col name='R.y' header_val='PosY - mm' qualifier='0' req='0' />
    <col name='R.area' header_val='Area - mm2' qualifier='0' req='0' />
    <col name='R.bkgd' header_val='Bkgd' qualifier='0' req='0' />
    <col name='R.sn' header_val='S/N' qualifier='0' req='0' />
    <col name='R.flag' header_val='Flag' qualifier='0' req='0' />
    <col name='R.percent_floor' header_val='% At Floor' qualifier='0' req='0' />
    <col name='R.percent_ceiling' header_val='% At Ceiling' qualifier='0' req='0' />
    <col name='R.bg_percent_floor' header_val='% At Floor - Bkgd' qualifier='0' req='0' />
    <col name='R.bg_percent_ceiling' header_val='% At Ceiling - Bkgd' qualifier='0' req='0' />
    <col name='R.mad' header_val='MAD' qualifier='0' req='0' />
    <col name='R.percent_removed' header_val='% Removed' qualifier='0' req='0' />
    <col name='R.percent_replaced' header_val='% Replaced' qualifier='0' req='0' />
    <col name='G.foreground' header_val='Dens - Levels' qualifier='1' req='1' />
    <col name='G.sd' header_val='SD - Levels' qualifier='1' req='0' />
    <col name='G.x' header_val='PosX - mm' qualifier='1' req='0' />
    <col name='G.y' header_val='PosY - mm' qualifier='1' req='0' />
    <col name='G.area' header_val='Area - mm2' qualifier='1' req='0' />
    <col name='G.bkgd' header_val='Bkgd' qualifier='1' req='0' />
    <col name='G.sn' header_val='S/N' qualifier='1' req='0' />
    <col name='G.flag' header_val='Flag' qualifier='1' req='0' />
    <col name='G.percent_floor' header_val='% At Floor' qualifier='1' req='0' />
    <col name='G.percent_ceiling' header_val='% At Ceiling' qualifier='1' req='0' />
    <col name='G.bg_percent_floor' header_val='% At Floor - Bkgd' qualifier='1' req='0' />
    <col name='G.bg_percent_ceiling' header_val='% At Ceiling - Bkgd' qualifier='1' req='0' />
    <col name='G.mad' header_val='MAD' qualifier='1' req='0' />
    <col name='G.percent_removed' header_val='% Removed' qualifier='1' req='0' />
    <col name='G.percent_replaced' header_val='% Replaced' qualifier='1' req='0' />
  </header>
 </inputs>

 <outputs>
  <map name='coordinate' >
    <in name='coor' />
    <do> $coor </do>
  </map>   
  <map name='foreground' >
    <in name='R.foreground' />
    <do> $R.foreground </do>
  </map>
  <map name='background' >
    <in name='R.bkgd' />
    <do> $R.bkgd </do>
  </map>
  <map name='sd' >
    <in name='R.sd' />
    <do> $R.sd</do>
  </map>
  <map name='signal_to_noise' >
    <in name='R.sn' />
    <do> $R.sn</do>
  </map>
  <map name='percent_at_floor' >
    <in name='R.percent_floor' />
    <do> $R.percent_floor</do>
  </map>
  <map name='percent_at_ceiling' >
    <in name='R.percent_ceiling' />
    <do> $R.percent_ceiling</do>
  </map>
  <map name='bkg_percent_at_floor' >
    <in name='R.bg_percent_floor' />
    <do> $R.bg_percent_floor</do>
  </map>
  <map name='bg_percent_at_ceiling' >
    <in name='R.bg_percent_ceiling' />
    <do> $R.bg_percent_ceiling</do>
  </map>
  <map name='x' >
    <in name='R.x' />
    <do> $R.x</do>
  </map>
  <map name='y' >
    <in name='R.y' />
    <do> $R.y</do>
  </map>
  <map name='area' >
    <in name='R.area' />
    <do> $R.area</do>
  </map>
  <map name='flag' >
    <in name='R.flag' />
    <do> $R.flag</do>
  </map>
  <map name='mad' >
    <in name='R.mad' />
    <do> $R.mad</do>
  </map>
  <map name='percent_removed' >
    <in name='R.percent_removed' />
    <do> $R.percent_removed</do>
  </map>
  <map name='percent_replaced' >
    <in name='R.replaced' />
    <do> $R.replaced</do>
  </map>
   <map name='foreground' >
    <in name='G.foreground' />
    <do> $G.foreground </do>
  </map>
  <map name='background' >
    <in name='G.bkgd' />
    <do> $G.bkgd </do>
  </map>
  <map name='sd' >
    <in name='G.sd' />
    <do> $G.sd</do>
  </map>
  <map name='signal_to_noise' >
    <in name='G.sn' />
    <do> $G.sn</do>
  </map>
  <map name='percent_at_floor' >
    <in name='G.percent_floor' />
    <do> $G.percent_floor</do>
  </map>
  <map name='percent_at_ceiling' >
    <in name='G.percent_ceiling' />
    <do> $G.percent_ceiling</do>
  </map>
  <map name='bkg_percent_at_floor' >
    <in name='G.bg_percent_floor' />
    <do> $G.bg_percent_floor</do>
  </map>
  <map name='bg_percent_at_ceiling' >
    <in name='G.bg_percent_ceiling' />
    <do> $G.bg_percent_ceiling</do>
  </map>
  <map name='x' >
    <in name='G.x' />
    <do> $G.x</do>
  </map>
  <map name='y' >
    <in name='G.y' />
    <do> $G.y</do>
  </map>
  <map name='area' >
    <in name='G.area' />
    <do> $G.area</do>
  </map>
  <map name='flag' >
    <in name='G.flag' />
    <do> $G.flag</do>
  </map>
  <map name='mad' >
    <in name='G.mad' />
    <do> $G.mad</do>
  </map>
  <map name='percent_removed' >
    <in name='G.percent_removed' />
    <do> $G.percent_removed</do>
  </map>
  <map name='percent_replaced' >
    <in name='G.replaced' />
    <do> $G.replaced</do>
  </map>
</output>
</cfg>
